{
  "version": 1,
  "name": "Image brightness relief",
  "source": "relief",
  "description": "24 × 16 studs. Brightness heightmap (light = high), NOT inferred 3D shape. 12-color classic palette; two interlocking backing layers included.",
  "bricks": [
    {
      "id": "b1",
      "part": "3020",
      "color": 71,
      "x": 0,
      "y": 0,
      "z": 0,
      "rotation": 0
    },
    {
      "id": "b2",
      "part": "3020",
      "color": 71,
      "x": 4,
      "y": 0,
      "z": 0,
      "rotation": 0
    },
    {
      "id": "b3",
      "part": "3020",
      "color": 71,
      "x": 8,
      "y": 0,
      "z": 0,
      "rotation": 0
    },
    {
      "id": "b4",
      "part": "3020",
      "color": 71,
      "x": 12,
      "y": 0,
      "z": 0,
      "rotation": 0
    },
    {
      "id": "b5",
      "part": "3020",
      "color": 71,
      "x": 16,
      "y": 0,
      "z": 0,
      "rotation": 0
    },
    {
      "id": "b6",
      "part": "3020",
      "color": 71,
      "x": 20,
      "y": 0,
      "z": 0,
      "rotation": 0
    },
    {
      "id": "b7",
      "part": "3020",
      "color": 71,
      "x": 0,
      "y": 0,
      "z": 2,
      "rotation": 0
    },
    {
      "id": "b8",
      "part": "3020",
      "color": 71,
      "x": 4,
      "y": 0,
      "z": 2,
      "rotation": 0
    },
    {
      "id": "b9",
      "part": "3020",
      "color": 71,
      "x": 8,
      "y": 0,
      "z": 2,
      "rotation": 0
    },
    {
      "id": "b10",
      "part": "3020",
      "color": 71,
      "x": 12,
      "y": 0,
      "z": 2,
      "rotation": 0
    },
    {
      "id": "b11",
      "part": "3020",
      "color": 71,
      "x": 16,
      "y": 0,
      "z": 2,
      "rotation": 0
    },
    {
      "id": "b12",
      "part": "3020",
      "color": 71,
      "x": 20,
      "y": 0,
      "z": 2,
      "rotation": 0
    },
    {
      "id": "b13",
      "part": "3020",
      "color": 71,
      "x": 0,
      "y": 0,
      "z": 4,
      "rotation": 0
    },
    {
      "id": "b14",
      "part": "3020",
      "color": 71,
      "x": 4,
      "y": 0,
      "z": 4,
      "rotation": 0
    },
    {
      "id": "b15",
      "part": "3020",
      "color": 71,
      "x": 8,
      "y": 0,
      "z": 4,
      "rotation": 0
    },
    {
      "id": "b16",
      "part": "3020",
      "color": 71,
      "x": 12,
      "y": 0,
      "z": 4,
      "rotation": 0
    },
    {
      "id": "b17",
      "part": "3020",
      "color": 71,
      "x": 16,
      "y": 0,
      "z": 4,
      "rotation": 0
    },
    {
      "id": "b18",
      "part": "3020",
      "color": 71,
      "x": 20,
      "y": 0,
      "z": 4,
      "rotation": 0
    },
    {
      "id": "b19",
      "part": "3020",
      "color": 71,
      "x": 0,
      "y": 0,
      "z": 6,
      "rotation": 0
    },
    {
      "id": "b20",
      "part": "3020",
      "color": 71,
      "x": 4,
      "y": 0,
      "z": 6,
      "rotation": 0
    },
    {
      "id": "b21",
      "part": "3020",
      "color": 71,
      "x": 8,
      "y": 0,
      "z": 6,
      "rotation": 0
    },
    {
      "id": "b22",
      "part": "3020",
      "color": 71,
      "x": 12,
      "y": 0,
      "z": 6,
      "rotation": 0
    },
    {
      "id": "b23",
      "part": "3020",
      "color": 71,
      "x": 16,
      "y": 0,
      "z": 6,
      "rotation": 0
    },
    {
      "id": "b24",
      "part": "3020",
      "color": 71,
      "x": 20,
      "y": 0,
      "z": 6,
      "rotation": 0
    },
    {
      "id": "b25",
      "part": "3020",
      "color": 71,
      "x": 0,
      "y": 0,
      "z": 8,
      "rotation": 0
    },
    {
      "id": "b26",
      "part": "3020",
      "color": 71,
      "x": 4,
      "y": 0,
      "z": 8,
      "rotation": 0
    },
    {
      "id": "b27",
      "part": "3020",
      "color": 71,
      "x": 8,
      "y": 0,
      "z": 8,
      "rotation": 0
    },
    {
      "id": "b28",
      "part": "3020",
      "color": 71,
      "x": 12,
      "y": 0,
      "z": 8,
      "rotation": 0
    },
    {
      "id": "b29",
      "part": "3020",
      "color": 71,
      "x": 16,
      "y": 0,
      "z": 8,
      "rotation": 0
    },
    {
      "id": "b30",
      "part": "3020",
      "color": 71,
      "x": 20,
      "y": 0,
      "z": 8,
      "rotation": 0
    },
    {
      "id": "b31",
      "part": "3020",
      "color": 71,
      "x": 0,
      "y": 0,
      "z": 10,
      "rotation": 0
    },
    {
      "id": "b32",
      "part": "3020",
      "color": 71,
      "x": 4,
      "y": 0,
      "z": 10,
      "rotation": 0
    },
    {
      "id": "b33",
      "part": "3020",
      "color": 71,
      "x": 8,
      "y": 0,
      "z": 10,
      "rotation": 0
    },
    {
      "id": "b34",
      "part": "3020",
      "color": 71,
      "x": 12,
      "y": 0,
      "z": 10,
      "rotation": 0
    },
    {
      "id": "b35",
      "part": "3020",
      "color": 71,
      "x": 16,
      "y": 0,
      "z": 10,
      "rotation": 0
    },
    {
      "id": "b36",
      "part": "3020",
      "color": 71,
      "x": 20,
      "y": 0,
      "z": 10,
      "rotation": 0
    },
    {
      "id": "b37",
      "part": "3020",
      "color": 71,
      "x": 0,
      "y": 0,
      "z": 12,
      "rotation": 0
    },
    {
      "id": "b38",
      "part": "3020",
      "color": 71,
      "x": 4,
      "y": 0,
      "z": 12,
      "rotation": 0
    },
    {
      "id": "b39",
      "part": "3020",
      "color": 71,
      "x": 8,
      "y": 0,
      "z": 12,
      "rotation": 0
    },
    {
      "id": "b40",
      "part": "3020",
      "color": 71,
      "x": 12,
      "y": 0,
      "z": 12,
      "rotation": 0
    },
    {
      "id": "b41",
      "part": "3020",
      "color": 71,
      "x": 16,
      "y": 0,
      "z": 12,
      "rotation": 0
    },
    {
      "id": "b42",
      "part": "3020",
      "color": 71,
      "x": 20,
      "y": 0,
      "z": 12,
      "rotation": 0
    },
    {
      "id": "b43",
      "part": "3020",
      "color": 71,
      "x": 0,
      "y": 0,
      "z": 14,
      "rotation": 0
    },
    {
      "id": "b44",
      "part": "3020",
      "color": 71,
      "x": 4,
      "y": 0,
      "z": 14,
      "rotation": 0
    },
    {
      "id": "b45",
      "part": "3020",
      "color": 71,
      "x": 8,
      "y": 0,
      "z": 14,
      "rotation": 0
    },
    {
      "id": "b46",
      "part": "3020",
      "color": 71,
      "x": 12,
      "y": 0,
      "z": 14,
      "rotation": 0
    },
    {
      "id": "b47",
      "part": "3020",
      "color": 71,
      "x": 16,
      "y": 0,
      "z": 14,
      "rotation": 0
    },
    {
      "id": "b48",
      "part": "3020",
      "color": 71,
      "x": 20,
      "y": 0,
      "z": 14,
      "rotation": 0
    },
    {
      "id": "b49",
      "part": "3024",
      "color": 71,
      "x": 0,
      "y": 1,
      "z": 0,
      "rotation": 0
    },
    {
      "id": "b50",
      "part": "3710",
      "color": 71,
      "x": 1,
      "y": 1,
      "z": 0,
      "rotation": 0
    },
    {
      "id": "b51",
      "part": "3710",
      "color": 71,
      "x": 5,
      "y": 1,
      "z": 0,
      "rotation": 0
    },
    {
      "id": "b52",
      "part": "3710",
      "color": 71,
      "x": 9,
      "y": 1,
      "z": 0,
      "rotation": 0
    },
    {
      "id": "b53",
      "part": "3710",
      "color": 71,
      "x": 13,
      "y": 1,
      "z": 0,
      "rotation": 0
    },
    {
      "id": "b54",
      "part": "3710",
      "color": 71,
      "x": 17,
      "y": 1,
      "z": 0,
      "rotation": 0
    },
    {
      "id": "b55",
      "part": "3623",
      "color": 71,
      "x": 21,
      "y": 1,
      "z": 0,
      "rotation": 0
    },
    {
      "id": "b56",
      "part": "3710",
      "color": 71,
      "x": 0,
      "y": 1,
      "z": 1,
      "rotation": 90
    },
    {
      "id": "b57",
      "part": "3020",
      "color": 71,
      "x": 1,
      "y": 1,
      "z": 1,
      "rotation": 90
    },
    {
      "id": "b58",
      "part": "3020",
      "color": 71,
      "x": 3,
      "y": 1,
      "z": 1,
      "rotation": 90
    },
    {
      "id": "b59",
      "part": "3020",
      "color": 71,
      "x": 5,
      "y": 1,
      "z": 1,
      "rotation": 90
    },
    {
      "id": "b60",
      "part": "3020",
      "color": 71,
      "x": 7,
      "y": 1,
      "z": 1,
      "rotation": 90
    },
    {
      "id": "b61",
      "part": "3020",
      "color": 71,
      "x": 9,
      "y": 1,
      "z": 1,
      "rotation": 90
    },
    {
      "id": "b62",
      "part": "3020",
      "color": 71,
      "x": 11,
      "y": 1,
      "z": 1,
      "rotation": 90
    },
    {
      "id": "b63",
      "part": "3020",
      "color": 71,
      "x": 13,
      "y": 1,
      "z": 1,
      "rotation": 90
    },
    {
      "id": "b64",
      "part": "3020",
      "color": 71,
      "x": 15,
      "y": 1,
      "z": 1,
      "rotation": 90
    },
    {
      "id": "b65",
      "part": "3020",
      "color": 71,
      "x": 17,
      "y": 1,
      "z": 1,
      "rotation": 90
    },
    {
      "id": "b66",
      "part": "3020",
      "color": 71,
      "x": 19,
      "y": 1,
      "z": 1,
      "rotation": 90
    },
    {
      "id": "b67",
      "part": "3020",
      "color": 71,
      "x": 21,
      "y": 1,
      "z": 1,
      "rotation": 90
    },
    {
      "id": "b68",
      "part": "3710",
      "color": 71,
      "x": 23,
      "y": 1,
      "z": 1,
      "rotation": 90
    },
    {
      "id": "b69",
      "part": "3710",
      "color": 71,
      "x": 0,
      "y": 1,
      "z": 5,
      "rotation": 90
    },
    {
      "id": "b70",
      "part": "3020",
      "color": 71,
      "x": 1,
      "y": 1,
      "z": 5,
      "rotation": 90
    },
    {
      "id": "b71",
      "part": "3020",
      "color": 71,
      "x": 3,
      "y": 1,
      "z": 5,
      "rotation": 90
    },
    {
      "id": "b72",
      "part": "3020",
      "color": 71,
      "x": 5,
      "y": 1,